{
  "$schema": "http://json-schema.org/draft-07/schema#",
  "title": "Euroleague Boxscore Schema",
  "description": "JSON Schema for Euroleague boxscore data - Generated from sample data analysis",
  "type": "object",
  "required": [
    "Live",
    "ByQuarter",
    "EndOfQuarter",
    "Stats"
  ],
  "properties": {
    "Live": {
      "type": "boolean",
      "description": "Whether the game is currently live"
    },
    "Referees": {
      "type": "string",
      "description": "Referee names separated by commas",
      "examples": [
        "RADOVIC, SRETEN, KOLJENSIC, MILOS, RACYS, SAULIUS",
        "LAURINAVICIUS, JURGIS, FOUFIS, IOANNIS, VYKLICKY, ROBERT",
        "DIFALLAH, MEHDI, CORTES, CARLOS, KONSTANTINOVS, KRISTAPS",
        "JAVOR, DAMIR, NIKOLIC, UROS, POROBIC, DRAGAN",
        "PERUGA, CARLOS, BISSANG, JOSEPH, KARDUM, LUKA"
      ]
    },
    "Attendance": {
      "type": "string",
      "pattern": "^\\d+$",
      "description": "Number of attendees (string format)"
    },
    "ByQuarter": {
      "type": "array",
      "description": "Πόντοι ανά quarter",
      "minItems": 2,
      "maxItems": 2,
      "items": {
        "type": "object",
        "required": [
          "Team",
          "Quarter1",
          "Quarter2",
          "Quarter3",
          "Quarter4"
        ],
        "properties": {
          "Team": {
            "type": "string",
            "enum": [
              "LDLC ASVEL VILLEURBANNE",
              "VALENCIA BASKET",
              "FC BAYERN MUNICH",
              "CRVENA ZVEZDA MERIDIANBET BELGRADE",
              "PARTIZAN MOZZART BET BELGRADE",
              "EA7 EMPORIO ARMANI MILAN",
              "REAL MADRID",
              "OLYMPIACOS PIRAEUS",
              "ANADOLU EFES ISTANBUL",
              "HAPOEL IBI TEL AVIV",
              "MACCABI RAPYD TEL AVIV",
              "PARIS BASKETBALL",
              "AS MONACO",
              "DUBAI BASKETBALL",
              "BASKONIA VITORIA-GASTEIZ",
              "PANATHINAIKOS AKTOR ATHENS",
              "FC BARCELONA",
              "VIRTUS BOLOGNA",
              "ZALGIRIS KAUNAS",
              "FENERBAHCE BEKO ISTANBUL"
            ]
          },
          "Quarter1": {
            "type": "integer",
            "minimum": 0
          },
          "Quarter2": {
            "type": "integer",
            "minimum": 0
          },
          "Quarter3": {
            "type": "integer",
            "minimum": 0
          },
          "Quarter4": {
            "type": "integer",
            "minimum": 0
          }
        }
      }
    },
    "EndOfQuarter": {
      "type": "array",
      "description": "Συνολικοί πόντοι στο τέλος κάθε quarter",
      "minItems": 2,
      "maxItems": 2,
      "items": {
        "type": "object",
        "required": [
          "Team",
          "Quarter1",
          "Quarter2",
          "Quarter3",
          "Quarter4"
        ],
        "properties": {
          "Team": {
            "type": "string",
            "enum": [
              "LDLC ASVEL VILLEURBANNE",
              "VALENCIA BASKET",
              "FC BAYERN MUNICH",
              "CRVENA ZVEZDA MERIDIANBET BELGRADE",
              "PARTIZAN MOZZART BET BELGRADE",
              "EA7 EMPORIO ARMANI MILAN",
              "REAL MADRID",
              "OLYMPIACOS PIRAEUS",
              "ANADOLU EFES ISTANBUL",
              "HAPOEL IBI TEL AVIV",
              "MACCABI RAPYD TEL AVIV",
              "PARIS BASKETBALL",
              "AS MONACO",
              "DUBAI BASKETBALL",
              "BASKONIA VITORIA-GASTEIZ",
              "PANATHINAIKOS AKTOR ATHENS",
              "FC BARCELONA",
              "VIRTUS BOLOGNA",
              "ZALGIRIS KAUNAS",
              "FENERBAHCE BEKO ISTANBUL"
            ]
          },
          "Quarter1": {
            "type": "integer",
            "minimum": 0
          },
          "Quarter2": {
            "type": "integer",
            "minimum": 0
          },
          "Quarter3": {
            "type": "integer",
            "minimum": 0
          },
          "Quarter4": {
            "type": "integer",
            "minimum": 0
          }
        }
      }
    },
    "Stats": {
      "type": "array",
      "description": "Στατιστικά ομάδων",
      "minItems": 2,
      "maxItems": 2,
      "items": {
        "type": "object",
        "required": [
          "Team",
          "Coach",
          "PlayersStats",
          "tmr",
          "totr"
        ],
        "properties": {
          "Team": {
            "type": "string",
            "enum": [
              "LDLC ASVEL VILLEURBANNE",
              "VALENCIA BASKET",
              "FC BAYERN MUNICH",
              "CRVENA ZVEZDA MERIDIANBET BELGRADE",
              "PARTIZAN MOZZART BET BELGRADE",
              "EA7 EMPORIO ARMANI MILAN",
              "REAL MADRID",
              "OLYMPIACOS PIRAEUS",
              "ANADOLU EFES ISTANBUL",
              "HAPOEL IBI TEL AVIV",
              "MACCABI RAPYD TEL AVIV",
              "PARIS BASKETBALL",
              "AS MONACO",
              "DUBAI BASKETBALL",
              "BASKONIA VITORIA-GASTEIZ",
              "PANATHINAIKOS AKTOR ATHENS",
              "FC BARCELONA",
              "VIRTUS BOLOGNA",
              "ZALGIRIS KAUNAS",
              "FENERBAHCE BEKO ISTANBUL"
            ]
          },
          "Coach": {
            "type": "string",
            "examples": [
              "POUPET, PIERRIC",
              "MARTINEZ, PEDRO",
              "HERBERT, GORDON",
              "SFAIROPOULOS, IOANNIS",
              "OBRADOVIC, ZELJKO",
              "MESSINA, ETTORE",
              "SCARIOLO, SERGIO",
              "BARTZOKAS, GEORGIOS",
              "KOKOSKOV, IGOR",
              "ITOUDIS, DIMITRIS"
            ]
          },
          "PlayersStats": {
            "type": "array",
            "description": "Στατιστικά παικτών",
            "items": {
              "$ref": "#/definitions/PlayerStats"
            }
          },
          "tmr": {
            "$ref": "#/definitions/TeamRebounds",
            "description": "Team rebounds"
          },
          "totr": {
            "$ref": "#/definitions/TeamTotals",
            "description": "Team totals"
          }
        }
      }
    }
  },
  "definitions": {
    "PlayerStats": {
      "type": "object",
      "required": [
        "Player_ID",
        "IsStarter",
        "IsPlaying",
        "Team",
        "Dorsal",
        "Player",
        "Minutes",
        "Points",
        "FieldGoalsMade2",
        "FieldGoalsAttempted2",
        "FieldGoalsMade3",
        "FieldGoalsAttempted3",
        "FreeThrowsMade",
        "FreeThrowsAttempted",
        "OffensiveRebounds",
        "DefensiveRebounds",
        "TotalRebounds",
        "Assistances",
        "Steals",
        "Turnovers",
        "BlocksFavour",
        "BlocksAgainst",
        "FoulsCommited",
        "FoulsReceived",
        "Valuation",
        "Plusminus"
      ],
      "properties": {
        "Player_ID": {
          "type": "string",
          "pattern": "^P\\d{6}\\s*$",
          "description": "Unique player ID"
        },
        "IsStarter": {
          "type": "integer",
          "enum": [
            0,
            1
          ]
        },
        "IsPlaying": {
          "type": "integer",
          "enum": [
            0,
            1
          ]
        },
        "Team": {
          "type": "string",
          "description": "Team abbreviation"
        },
        "Dorsal": {
          "type": "string",
          "description": "Jersey number"
        },
        "Player": {
          "type": "string",
          "description": "Player name (SURNAME, NAME format)"
        },
        "Minutes": {
          "oneOf": [
            {
              "type": "string",
              "pattern": "^(\\d{1,2}:\\d{2}|DNP)$"
            },
            {
              "type": "null"
            }
          ],
          "description": "Minutes played (MM:SS format) or 'DNP' for Did Not Play"
        },
        "Points": {
          "type": "integer",
          "minimum": 0
        },
        "FieldGoalsMade2": {
          "type": "integer",
          "minimum": 0
        },
        "FieldGoalsAttempted2": {
          "type": "integer",
          "minimum": 0
        },
        "FieldGoalsMade3": {
          "type": "integer",
          "minimum": 0
        },
        "FieldGoalsAttempted3": {
          "type": "integer",
          "minimum": 0
        },
        "FreeThrowsMade": {
          "type": "integer",
          "minimum": 0
        },
        "FreeThrowsAttempted": {
          "type": "integer",
          "minimum": 0
        },
        "OffensiveRebounds": {
          "type": "integer",
          "minimum": 0
        },
        "DefensiveRebounds": {
          "type": "integer",
          "minimum": 0
        },
        "TotalRebounds": {
          "type": "integer",
          "minimum": 0
        },
        "Assistances": {
          "type": "integer",
          "minimum": 0
        },
        "Steals": {
          "type": "integer",
          "minimum": 0
        },
        "Turnovers": {
          "type": "integer",
          "minimum": 0
        },
        "BlocksFavour": {
          "type": "integer",
          "minimum": 0
        },
        "BlocksAgainst": {
          "type": "integer",
          "minimum": 0
        },
        "FoulsCommited": {
          "type": "integer",
          "minimum": 0
        },
        "FoulsReceived": {
          "type": "integer",
          "minimum": 0
        },
        "Valuation": {
          "type": "integer"
        },
        "Plusminus": {
          "oneOf": [
            {
              "type": "integer"
            },
            {
              "type": "null"
            }
          ]
        }
      }
    },
    "TeamRebounds": {
      "type": "object",
      "description": "Team rebounds (not attributed to individual players)",
      "properties": {
        "Player_ID": {
          "type": "string",
          "pattern": "^\\s*$"
        },
        "IsStarter": {
          "type": "integer",
          "enum": [
            0
          ]
        },
        "IsPlaying": {
          "type": "integer",
          "enum": [
            0
          ]
        },
        "Team": {
          "type": "string"
        },
        "Dorsal": {
          "type": "string",
          "maxLength": 0
        },
        "Player": {
          "type": "string",
          "maxLength": 0
        },
        "Minutes": {
          "type": "null"
        },
        "Points": {
          "type": "integer",
          "enum": [
            0
          ]
        },
        "FieldGoalsMade2": {
          "type": "integer",
          "enum": [
            0
          ]
        },
        "FieldGoalsAttempted2": {
          "type": "integer",
          "enum": [
            0
          ]
        },
        "FieldGoalsMade3": {
          "type": "integer",
          "enum": [
            0
          ]
        },
        "FieldGoalsAttempted3": {
          "type": "integer",
          "enum": [
            0
          ]
        },
        "FreeThrowsMade": {
          "type": "integer",
          "enum": [
            0
          ]
        },
        "FreeThrowsAttempted": {
          "type": "integer",
          "enum": [
            0
          ]
        },
        "OffensiveRebounds": {
          "type": "integer",
          "minimum": 0
        },
        "DefensiveRebounds": {
          "type": "integer",
          "minimum": 0
        },
        "TotalRebounds": {
          "type": "integer",
          "minimum": 0
        },
        "Assistances": {
          "type": "integer",
          "enum": [
            0
          ]
        },
        "Steals": {
          "type": "integer",
          "enum": [
            0
          ]
        },
        "Turnovers": {
          "type": "integer",
          "enum": [
            0
          ]
        },
        "BlocksFavour": {
          "type": "integer",
          "enum": [
            0
          ]
        },
        "BlocksAgainst": {
          "type": "integer",
          "enum": [
            0
          ]
        },
        "FoulsCommited": {
          "type": "integer",
          "enum": [
            0
          ]
        },
        "FoulsReceived": {
          "type": "integer",
          "enum": [
            0
          ]
        },
        "Valuation": {
          "type": "integer",
          "minimum": 0
        },
        "Plusminus": {
          "type": "null"
        }
      }
    },
    "TeamTotals": {
      "type": "object",
      "description": "Team total statistics",
      "required": [
        "Minutes",
        "Points",
        "FieldGoalsMade2",
        "FieldGoalsAttempted2",
        "FieldGoalsMade3",
        "FieldGoalsAttempted3",
        "FreeThrowsMade",
        "FreeThrowsAttempted",
        "OffensiveRebounds",
        "DefensiveRebounds",
        "TotalRebounds",
        "Assistances",
        "Steals",
        "Turnovers",
        "BlocksFavour",
        "BlocksAgainst",
        "FoulsCommited",
        "FoulsReceived",
        "Valuation"
      ],
      "properties": {
        "Minutes": {
          "type": "string",
          "pattern": "^200:00$"
        },
        "Points": {
          "type": "integer",
          "minimum": 0
        },
        "FieldGoalsMade2": {
          "type": "integer",
          "minimum": 0
        },
        "FieldGoalsAttempted2": {
          "type": "integer",
          "minimum": 0
        },
        "FieldGoalsMade3": {
          "type": "integer",
          "minimum": 0
        },
        "FieldGoalsAttempted3": {
          "type": "integer",
          "minimum": 0
        },
        "FreeThrowsMade": {
          "type": "integer",
          "minimum": 0
        },
        "FreeThrowsAttempted": {
          "type": "integer",
          "minimum": 0
        },
        "OffensiveRebounds": {
          "type": "integer",
          "minimum": 0
        },
        "DefensiveRebounds": {
          "type": "integer",
          "minimum": 0
        },
        "TotalRebounds": {
          "type": "integer",
          "minimum": 0
        },
        "Assistances": {
          "type": "integer",
          "minimum": 0
        },
        "Steals": {
          "type": "integer",
          "minimum": 0
        },
        "Turnovers": {
          "type": "integer",
          "minimum": 0
        },
        "BlocksFavour": {
          "type": "integer",
          "minimum": 0
        },
        "BlocksAgainst": {
          "type": "integer",
          "minimum": 0
        },
        "FoulsCommited": {
          "type": "integer",
          "minimum": 0
        },
        "FoulsReceived": {
          "type": "integer",
          "minimum": 0
        },
        "Valuation": {
          "type": "integer"
        }
      }
    }
  }
}