{
  "Live": false,
  "Referees": "JAVOR, DAMIR, ALIAGA, JORDI, GIOVANNETTI, GUIDO",
  "Attendance": "2110",
  "ByQuarter": [
    {
      "Team": "ANADOLU EFES ISTANBUL",
      "Quarter1": 21,
      "Quarter2": 19,
      "Quarter3": 20,
      "Quarter4": 25
    },
    {
      "Team": "MACCABI RAPYD TEL AVIV",
      "Quarter1": 19,
      "Quarter2": 25,
      "Quarter3": 15,
      "Quarter4": 19
    }
  ],
  "EndOfQuarter": [
    {
      "Team": "ANADOLU EFES ISTANBUL",
      "Quarter1": 21,
      "Quarter2": 40,
      "Quarter3": 60,
      "Quarter4": 85
    },
    {
      "Team": "MACCABI RAPYD TEL AVIV",
      "Quarter1": 19,
      "Quarter2": 44,
      "Quarter3": 59,
      "Quarter4": 78
    }
  ],
  "Stats": [
    {
      "Team": "ANADOLU EFES ISTANBUL",
      "Coach": "KOKOSKOV, IGOR",
      "PlayersStats": [
        {
          "Player_ID": "P007200   ",
          "IsStarter": 1,
          "IsPlaying": 1,
          "Team": "IST",
          "Dorsal": "0",
          "Player": "LARKIN, SHANE",
          "Minutes": "33:21",
          "Points": 14,
          "FieldGoalsMade2": 5,
          "FieldGoalsAttempted2": 8,
          "FieldGoalsMade3": 0,
          "FieldGoalsAttempted3": 4,
          "FreeThrowsMade": 4,
          "FreeThrowsAttempted": 6,
          "OffensiveRebounds": 1,
          "DefensiveRebounds": 3,
          "TotalRebounds": 4,
          "Assistances": 5,
          "Steals": 0,
          "Turnovers": 2,
          "BlocksFavour": 0,
          "BlocksAgainst": 1,
          "FoulsCommited": 3,
          "FoulsReceived": 4,
          "Valuation": 12,
          "Plusminus": 8
        },
        {
          "Player_ID": "P006590   ",
          "IsStarter": 0,
          "IsPlaying": 0,
          "Team": "IST",
          "Dorsal": "1",
          "Player": "BEAUBOIS, RODRIGUE",
          "Minutes": "DNP",
          "Points": 0,
          "FieldGoalsMade2": 0,
          "FieldGoalsAttempted2": 0,
          "FieldGoalsMade3": 0,
          "FieldGoalsAttempted3": 0,
          "FreeThrowsMade": 0,
          "FreeThrowsAttempted": 0,
          "OffensiveRebounds": 0,
          "DefensiveRebounds": 0,
          "TotalRebounds": 0,
          "Assistances": 0,
          "Steals": 0,
          "Turnovers": 0,
          "BlocksFavour": 0,
          "BlocksAgainst": 0,
          "FoulsCommited": 0,
          "FoulsReceived": 0,
          "Valuation": 0,
          "Plusminus": 0
        },
        {
          "Player_ID": "P011201   ",
          "IsStarter": 0,
          "IsPlaying": 0,
          "Team": "IST",
          "Dorsal": "2",
          "Player": "HAZER, SEHMUS",
          "Minutes": "07:41",
          "Points": 0,
          "FieldGoalsMade2": 0,
          "FieldGoalsAttempted2": 1,
          "FieldGoalsMade3": 0,
          "FieldGoalsAttempted3": 2,
          "FreeThrowsMade": 0,
          "FreeThrowsAttempted": 0,
          "OffensiveRebounds": 2,
          "DefensiveRebounds": 2,
          "TotalRebounds": 4,
          "Assistances": 0,
          "Steals": 1,
          "Turnovers": 4,
          "BlocksFavour": 0,
          "BlocksAgainst": 1,
          "FoulsCommited": 1,
          "FoulsReceived": 0,
          "Valuation": -4,
          "Plusminus": -1
        },
        {
          "Player_ID": "P009754   ",
          "IsStarter": 0,
          "IsPlaying": 1,
          "Team": "IST",
          "Dorsal": "3",
          "Player": "LOYD, JORDAN",
          "Minutes": "24:15",
          "Points": 16,
          "FieldGoalsMade2": 2,
          "FieldGoalsAttempted2": 2,
          "FieldGoalsMade3": 4,
          "FieldGoalsAttempted3": 8,
          "FreeThrowsMade": 0,
          "FreeThrowsAttempted": 0,
          "OffensiveRebounds": 1,
          "DefensiveRebounds": 1,
          "TotalRebounds": 2,
          "Assistances": 1,
          "Steals": 0,
          "Turnovers": 2,
          "BlocksFavour": 0,
          "BlocksAgainst": 0,
          "FoulsCommited": 1,
          "FoulsReceived": 3,
          "Valuation": 15,
          "Plusminus": 6
        },
        {
          "Player_ID": "P010391   ",
          "IsStarter": 1,
          "IsPlaying": 1,
          "Team": "IST",
          "Dorsal": "8",
          "Player": "WEILER-BABB, NICK",
          "Minutes": "22:53",
          "Points": 12,
          "FieldGoalsMade2": 1,
          "FieldGoalsAttempted2": 1,
          "FieldGoalsMade3": 3,
          "FieldGoalsAttempted3": 4,
          "FreeThrowsMade": 1,
          "FreeThrowsAttempted": 1,
          "OffensiveRebounds": 0,
          "DefensiveRebounds": 4,
          "TotalRebounds": 4,
          "Assistances": 3,
          "Steals": 2,
          "Turnovers": 1,
          "BlocksFavour": 0,
          "BlocksAgainst": 0,
          "FoulsCommited": 3,
          "FoulsReceived": 3,
          "Valuation": 19,
          "Plusminus": 4
        },
        {
          "Player_ID": "P005844   ",
          "IsStarter": 0,
          "IsPlaying": 0,
          "Team": "IST",
          "Dorsal": "9",
          "Player": "PAPAGIANNIS, GEORGIOS",
          "Minutes": "13:20",
          "Points": 2,
          "FieldGoalsMade2": 1,
          "FieldGoalsAttempted2": 2,
          "FieldGoalsMade3": 0,
          "FieldGoalsAttempted3": 1,
          "FreeThrowsMade": 0,
          "FreeThrowsAttempted": 0,
          "OffensiveRebounds": 4,
          "DefensiveRebounds": 3,
          "TotalRebounds": 7,
          "Assistances": 1,
          "Steals": 0,
          "Turnovers": 0,
          "BlocksFavour": 0,
          "BlocksAgainst": 0,
          "FoulsCommited": 2,
          "FoulsReceived": 3,
          "Valuation": 9,
          "Plusminus": 7
        },
        {
          "Player_ID": "P009549   ",
          "IsStarter": 1,
          "IsPlaying": 1,
          "Team": "IST",
          "Dorsal": "10",
          "Player": "CORDINIER, ISAIA",
          "Minutes": "30:50",
          "Points": 7,
          "FieldGoalsMade2": 3,
          "FieldGoalsAttempted2": 7,
          "FieldGoalsMade3": 0,
          "FieldGoalsAttempted3": 4,
          "FreeThrowsMade": 1,
          "FreeThrowsAttempted": 1,
          "OffensiveRebounds": 2,
          "DefensiveRebounds": 1,
          "TotalRebounds": 3,
          "Assistances": 2,
          "Steals": 0,
          "Turnovers": 0,
          "BlocksFavour": 0,
          "BlocksAgainst": 1,
          "FoulsCommited": 2,
          "FoulsReceived": 2,
          "Valuation": 3,
          "Plusminus": 11
        },
        {
          "Player_ID": "P007109   ",
          "IsStarter": 0,
          "IsPlaying": 0,
          "Team": "IST",
          "Dorsal": "11",
          "Player": "SMITS, ROLANDS",
          "Minutes": "15:50",
          "Points": 16,
          "FieldGoalsMade2": 5,
          "FieldGoalsAttempted2": 7,
          "FieldGoalsMade3": 2,
          "FieldGoalsAttempted3": 3,
          "FreeThrowsMade": 0,
          "FreeThrowsAttempted": 0,
          "OffensiveRebounds": 1,
          "DefensiveRebounds": 2,
          "TotalRebounds": 3,
          "Assistances": 1,
          "Steals": 1,
          "Turnovers": 0,
          "BlocksFavour": 0,
          "BlocksAgainst": 0,
          "FoulsCommited": 2,
          "FoulsReceived": 1,
          "Valuation": 17,
          "Plusminus": 8
        },
        {
          "Player_ID": "P014025   ",
          "IsStarter": 0,
          "IsPlaying": 0,
          "Team": "IST",
          "Dorsal": "21",
          "Player": "SWIDER, COLE",
          "Minutes": "01:47",
          "Points": 0,
          "FieldGoalsMade2": 0,
          "FieldGoalsAttempted2": 0,
          "FieldGoalsMade3": 0,
          "FieldGoalsAttempted3": 0,
          "FreeThrowsMade": 0,
          "FreeThrowsAttempted": 0,
          "OffensiveRebounds": 0,
          "DefensiveRebounds": 0,
          "TotalRebounds": 0,
          "Assistances": 0,
          "Steals": 0,
          "Turnovers": 0,
          "BlocksFavour": 0,
          "BlocksAgainst": 0,
          "FoulsCommited": 1,
          "FoulsReceived": 0,
          "Valuation": -1,
          "Plusminus": -7
        },
        {
          "Player_ID": "P012710   ",
          "IsStarter": 1,
          "IsPlaying": 1,
          "Team": "IST",
          "Dorsal": "24",
          "Player": "OSMANI, ERCAN",
          "Minutes": "31:41",
          "Points": 12,
          "FieldGoalsMade2": 4,
          "FieldGoalsAttempted2": 7,
          "FieldGoalsMade3": 0,
          "FieldGoalsAttempted3": 3,
          "FreeThrowsMade": 4,
          "FreeThrowsAttempted": 5,
          "OffensiveRebounds": 2,
          "DefensiveRebounds": 2,
          "TotalRebounds": 4,
          "Assistances": 2,
          "Steals": 2,
          "Turnovers": 3,
          "BlocksFavour": 0,
          "BlocksAgainst": 0,
          "FoulsCommited": 2,
          "FoulsReceived": 3,
          "Valuation": 11,
          "Plusminus": 13
        },
        {
          "Player_ID": "P006372   ",
          "IsStarter": 0,
          "IsPlaying": 0,
          "Team": "IST",
          "Dorsal": "33",
          "Player": "YILMAZ, ERKAN",
          "Minutes": "01:12",
          "Points": 0,
          "FieldGoalsMade2": 0,
          "FieldGoalsAttempted2": 0,
          "FieldGoalsMade3": 0,
          "FieldGoalsAttempted3": 0,
          "FreeThrowsMade": 0,
          "FreeThrowsAttempted": 0,
          "OffensiveRebounds": 0,
          "DefensiveRebounds": 0,
          "TotalRebounds": 0,
          "Assistances": 0,
          "Steals": 0,
          "Turnovers": 1,
          "BlocksFavour": 0,
          "BlocksAgainst": 0,
          "FoulsCommited": 1,
          "FoulsReceived": 0,
          "Valuation": -2,
          "Plusminus": -7
        },
        {
          "Player_ID": "P014102   ",
          "IsStarter": 1,
          "IsPlaying": 0,
          "Team": "IST",
          "Dorsal": "88",
          "Player": "JONES, KAI",
          "Minutes": "17:10",
          "Points": 6,
          "FieldGoalsMade2": 2,
          "FieldGoalsAttempted2": 2,